{
  "id": "copernicus-egu",
  "title": "Copernicus / EGU journals (Ocean Science, Geoscientific Model Development)",
  "publisher": "Copernicus Publications (on behalf of EGU)",
  "canvas": { "single_column_mm": 83, "double_column_mm": 170, "max_height_mm": 230 },
  "raster_dpi": { "photo": 300, "combination": 600, "line": 1200 },
  "map_target": { "recommended_format": "pdf", "recommended_dpi": 600 },
  "formats_accepted": ["pdf", "eps"],
  "colour_mode": "RGB",
  "min_font_pt": 7,
  "font_family_hint": "Arial/Helvetica",
  "notes": "Copernicus prefers vector graphics (PDF/EPS) with embedded fonts; raster only where unavoidable (photos 300 dpi, maps/combination 600 dpi). Single column ~83 mm, double column ~170 mm.",
  "source_url": "https://publications.copernicus.org/for_authors/manuscript_preparation.html",
  "last_verified": "VERIFY-BEFORE-SHIP"
}
